<?xml version="1.0" encoding="UTF-8"?>
<iz:Izvestaj 
	xmlns:xs="http://www.w3.org/2001/XMLSchema"
	xmlns:iz="http:///www.ftn.uns.ac.rs/vakcinacija/izvestaj"  
    xmlns:addr="http://www.ftn.uns.ac.rs/rdf/izvestaj"
    xmlns:pred="http://www.ftn.uns.ac.rs/rdf/izvestaj/predicate/"
    xmlns:xsi="http://www.w3.org/2001/XMLSchema-instance" xsi:schemaLocation="http:///www.ftn.uns.ac.rs/vakcinacija/izvestaj ../xsd/izvestaj.xsd"
    DatumIzdavanja = "2022-09-11"
    vocab="http://www.ftn.uns.ac.rs/rdf/izvestaj/" 
    about="http://www.ftn.uns.ac.rs/rdf/izvestaj/2021-08-01/2021-09-01">
    <iz:PeriodIzvestaja>
        <iz:OdDatum>2021-08-01</iz:OdDatum>
        <iz:DoDatum>2021-09-01</iz:DoDatum>
    </iz:PeriodIzvestaja>
    <iz:BrojPodnetihDokumenata property = "pred:brojPodnetihDokumenata" datatype = "xs:positiveInteger">2758</iz:BrojPodnetihDokumenata>
    <iz:ZahteviZaDigitalniSertifikat>
        <iz:BrojPrimljenih property = "pred:brojPrimljenih" datatype = "xs:positiveInteger">456</iz:BrojPrimljenih>
        <iz:BrojIzdatih property = "pred:brojIzdatih" datatype = "xs:positiveInteger">428</iz:BrojIzdatih>
    </iz:ZahteviZaDigitalniSertifikat>
    <iz:UkupanBrojDatihDoza>3225</iz:UkupanBrojDatihDoza>
    <iz:KolicnaDozaPoRednomBroju>
            <iz:RedniBroj>1</iz:RedniBroj>
            <iz:BrojDatihDoza>1789</iz:BrojDatihDoza>
    </iz:KolicnaDozaPoRednomBroju>
    <iz:KolicnaDozaPoRednomBroju>
        <iz:RedniBroj>2</iz:RedniBroj>
        <iz:BrojDatihDoza>1276</iz:BrojDatihDoza>
    </iz:KolicnaDozaPoRednomBroju>
    <iz:KolicnaDozaPoRednomBroju>
        <iz:RedniBroj>3</iz:RedniBroj>
        <iz:BrojDatihDoza>160</iz:BrojDatihDoza>
    </iz:KolicnaDozaPoRednomBroju>
    <iz:RaspodelaDozaPoProizvodjacu>
        <iz:Proizvodjac>Pfizer-BioNTech</iz:Proizvodjac>
        <iz:BrojDatihDoza>1625</iz:BrojDatihDoza>
    </iz:RaspodelaDozaPoProizvodjacu>
    <iz:RaspodelaDozaPoProizvodjacu>
        <iz:Proizvodjac>Sinopharm</iz:Proizvodjac>
        <iz:BrojDatihDoza>1100</iz:BrojDatihDoza>
    </iz:RaspodelaDozaPoProizvodjacu>
    <iz:RaspodelaDozaPoProizvodjacu>
        <iz:Proizvodjac>Sputnik V (Gamaleya истраживачки центар)</iz:Proizvodjac>
        <iz:BrojDatihDoza>356</iz:BrojDatihDoza>
    </iz:RaspodelaDozaPoProizvodjacu>
    <iz:RaspodelaDozaPoProizvodjacu>
        <iz:Proizvodjac>AstraZeneca</iz:Proizvodjac>
        <iz:BrojDatihDoza>144</iz:BrojDatihDoza>
    </iz:RaspodelaDozaPoProizvodjacu>
</iz:Izvestaj>